{"artifacts":[{"artifact_type":"bridge","build_metadata":"ELF 64-bit LSB PIE x86-64; compiler=gcc (Ubuntu 13.3.0-6ubuntu2~24.04.1) 13.3.0","distribution_authority":"GPL-2.0-or-later; see THIRD_PARTY_NOTICES.md","node":"base","repo_path":"runtime/base/bladeRF-linux-mac80211.hwsim42","sha256":"a2d1be1adff8850b34d5d73dabebb39056419c52375f8e61dbe22d1d8139d5cb","size_bytes":194640,"source_metadata":{"file_type":"regular","mode":"0775","uid_gid":"1002:1002"},"source_snapshot_path":"/sealed-snapshots/base/bladeRF-linux-mac80211.hwsim42"},{"artifact_type":"rbf","build_metadata":"unknown","distribution_authority":"upstream open-source terms; see THIRD_PARTY_NOTICES.md","node":"base","repo_path":"firmware/base/bladerf_wlan.rbf","sha256":"cd82e18eb39a7b9832ece316e136a2de64c30cf16ffc53649051695cb215251c","size_bytes":12858972,"source_metadata":{"file_type":"regular","mode":"0444","uid_gid":"0:0"},"source_snapshot_path":"/sealed-snapshots/base/bladerf_wlan.rbf"},{"artifact_type":"bridge","build_metadata":"unknown","distribution_authority":"GPL-2.0-or-later; see THIRD_PARTY_NOTICES.md","node":"jetson","repo_path":"runtime/jetson/bladeRF-linux-mac80211.hwsim42","sha256":"398ee978ba6f28f861df4163a7aee1b1773e63002135611d7279296217cc77d5","size_bytes":262560,"source_metadata":{"file_type":"regular","mode":"0755","uid_gid":"0:0"},"source_snapshot_path":"/sealed-snapshots/jetson/bladeRF-linux-mac80211.hwsim42"},{"artifact_type":"hwsim","build_metadata":"vermagic=4.9.337-tegra SMP preempt mod_unload modversions aarch64","distribution_authority":"GPL-2.0-only; see THIRD_PARTY_NOTICES.md","node":"jetson","repo_path":"firmware/jetson/mac80211_hwsim.ko","sha256":"dc08504f71ad995aed79ef7c77ce53836a78226a026ba905fa6c6eb0757ccb62","size_bytes":866976,"source_metadata":{"file_type":"regular","mode":"0444","uid_gid":"0:0"},"source_snapshot_path":"/sealed-snapshots/jetson/mac80211_hwsim.ko"},{"artifact_type":"rbf","build_metadata":"unknown","distribution_authority":"upstream open-source terms; see THIRD_PARTY_NOTICES.md","node":"jetson","repo_path":"firmware/jetson/bladerf_wlan.rbf","sha256":"c8881ffa7423d98cdd85936322a8870f686d7a23451c68ce735f314c64d19191","size_bytes":12858972,"source_metadata":{"file_type":"regular","mode":"0444","uid_gid":"0:0"},"source_snapshot_path":"/sealed-snapshots/jetson/bladerf_wlan.rbf"}],"generated_configs":[{"generator_name":"baseline_manifest.render_generated_config","generator_version":1,"node":"base","repo_path":"generated/base.env"},{"generator_name":"baseline_manifest.render_generated_config","generator_version":1,"node":"jetson","repo_path":"generated/jetson.env"}],"provenance":{"build_metadata":"unknown"},"release":{"firmware_state":"verified","runtime_state":"verified"},"schema_id":"https://bladerf-mesh.local/schema/baseline-manifest.schema.json","schema_version":1}
